{
  "ticker": "META",
  "lastReviewed": "2026-05-18",
  "agentThesis": {
    "baseCase": "Ad engine resilience + AI engagement + operating leverage.",
    "bullCase": "Bull case to be refined by OpenClaw finance agent: identify the specific catalyst, time horizon, and evidence required for META to deserve more capital.",
    "bearCase": "Bear case to be refined by OpenClaw finance agent: identify what would make META a value trap, crowded trade, or thesis break.",
    "invalidation": "AI capex, regulation, metaverse spend creep.",
    "currentBias": "HOLD / WATCH",
    "confidence": 0.84
  },
  "technicalMap": {
    "trendRegime": "deteriorating multi-week trend",
    "supportLevels": [
      565.09,
      515.95
    ],
    "resistanceLevels": [
      687.94,
      724.79
    ],
    "buyZone": [
      565.09,
      601.95
    ],
    "trimZone": [
      724.79,
      810.78
    ],
    "stopZone": [
      515.95
    ],
    "fractalRead": "Agent should map daily, weekly, and monthly structure before changing strategy. Current seed is a placeholder derived from live price bands.",
    "multiTimeframeRead": "Agent should compare short-term momentum against longer-term thesis persistence. Do not let a one-day move dominate the strategic read."
  },
  "strategyProtocol": {
    "holdIf": [
      "Thesis remains intact.",
      "Position size remains inside risk budget.",
      "No material deterioration in trend, liquidity, or data quality."
    ],
    "addIf": [
      "Price enters buy/add zone with supportive volume.",
      "Scorecard weakness is data-related rather than thesis-related.",
      "Macro pressure is stable or improving."
    ],
    "trimIf": [
      "Position exceeds configured risk budget.",
      "Price enters trim zone without corresponding thesis upgrade.",
      "Weakest factor deteriorates for two consecutive reviews."
    ],
    "exitIf": [
      "Thesis invalidation condition is triggered.",
      "Liquidity or event risk becomes unacceptable.",
      "Signal escalates to EXIT REVIEW with confirmed evidence."
    ],
    "doNothingIf": [
      "Signal conflict is unresolved.",
      "Missing data prevents a clean conclusion.",
      "Move is noise inside the action bands."
    ]
  },
  "agentLog": [
    {
      "date": "2026-05-18",
      "observation": "Seeded from live portfolio state. META signal is HOLD / WATCH; portfolio weight is 8.43%.",
      "changedSinceLastReview": "Initial agent-note seed; no prior review history yet.",
      "recommendedReaction": "HOLD / WATCH",
      "uncertainty": "Agent-written thesis and technical map require refinement after source review.",
      "nextCheck": "Review after next market-data refresh or material price/signal change."
    }
  ],
  "openQuestions": [
    "What evidence would justify adding to META rather than simply holding?",
    "What exact condition invalidates the META thesis?",
    "Is current weakness/opportunity driven by price action, fundamentals, macro pressure, or missing data?"
  ]
}
