{
  "ticker": "IAU",
  "lastReviewed": "2026-09-02",
  "agentThesis": {
    "baseCase": "Newly synced from live Robinhood account; needs thesis, risk-band, and fundamentals review.",
    "bullCase": "Bull case to be refined by OpenClaw finance agent: identify the specific catalyst, time horizon, and evidence required for IAU to deserve more capital.",
    "bearCase": "Bear case to be refined by OpenClaw finance agent: identify what would make IAU a value trap, crowded trade, or thesis break.",
    "invalidation": "Pending review.",
    "currentBias": "REVIEW",
    "confidence": 0.6
  },
  "technicalMap": {
    "trendRegime": "mixed / transitional trend",
    "supportLevels": [
      74.83,
      68.33
    ],
    "resistanceLevels": [
      91.1,
      95.98
    ],
    "buyZone": [
      74.83,
      79.71
    ],
    "trimZone": [
      95.98,
      107.37
    ],
    "stopZone": [
      68.33
    ],
    "fractalRead": "Agent should map daily, weekly, and monthly structure before changing strategy. Current seed is a placeholder derived from live price bands.",
    "multiTimeframeRead": "Agent should compare short-term momentum against longer-term thesis persistence. Do not let a one-day move dominate the strategic read."
  },
  "strategyProtocol": {
    "holdIf": [
      "Thesis remains intact.",
      "Position size remains inside risk budget.",
      "No material deterioration in trend, liquidity, or data quality."
    ],
    "addIf": [
      "Price enters buy/add zone with supportive volume.",
      "Scorecard weakness is data-related rather than thesis-related.",
      "Macro pressure is stable or improving."
    ],
    "trimIf": [
      "Position exceeds configured risk budget.",
      "Price enters trim zone without corresponding thesis upgrade.",
      "Weakest factor deteriorates for two consecutive reviews."
    ],
    "exitIf": [
      "Thesis invalidation condition is triggered.",
      "Liquidity or event risk becomes unacceptable.",
      "Signal escalates to EXIT REVIEW with confirmed evidence."
    ],
    "doNothingIf": [
      "Signal conflict is unresolved.",
      "Missing data prevents a clean conclusion.",
      "Move is noise inside the action bands."
    ]
  },
  "agentLog": [
    {
      "date": "2026-09-02",
      "observation": "Seeded from live portfolio state. IAU signal is REVIEW; portfolio weight is 10.01%.",
      "changedSinceLastReview": "Initial agent-note seed; no prior review history yet.",
      "recommendedReaction": "REVIEW",
      "uncertainty": "Agent-written thesis and technical map require refinement after source review.",
      "nextCheck": "Review after next market-data refresh or material price/signal change."
    }
  ],
  "openQuestions": [
    "What evidence would justify adding to IAU rather than simply holding?",
    "What exact condition invalidates the IAU thesis?",
    "Is current weakness/opportunity driven by price action, fundamentals, macro pressure, or missing data?"
  ]
}
